{
  "$schema": "https://json-schema.org/draft/2020-12/schema",
  "$id": "functional-parity-zero-gap-report/v1",
  "type": "object",
  "additionalProperties": false,
  "required": ["schema_version", "status", "exit_code", "mode", "falsifier_id", "projection_write", "source_manifest_sha256", "inventory_artifact_sha256", "row_counts", "status_counts", "failures", "mismatches", "openapi_reconciliation_ref", "verification"],
  "properties": {
    "$schema": {"type": "string", "const": "https://json-schema.org/draft/2020-12/schema"},
    "schema_version": {"type": "string", "const": "functional-parity-zero-gap-report/v1"},
    "status": {"type": "string", "enum": ["zero_gap", "falsifier_passed", "projection_written", "gaps_found", "unresolved", "duplicate", "stale", "source_unavailable", "source_hash_drift", "schema_invalid", "nondeterministic_output", "runtime_unavailable", "accepted_intent_invalid", "command_error"]},
    "exit_code": {"type": "integer", "enum": [0, 2, 3, 4, 5, 6, 7, 8, 9, 10, 11, 12, 13, 14]},
    "mode": {"type": "string", "enum": ["diff", "write", "fixture_injection"]},
    "falsifier_id": {"type": ["string", "null"], "enum": [null, "F0_deterministic_replay", "F1_missing_required_source", "F2_source_hash_drift", "F3_duplicate_legacy_route", "F4_dead_unimported_source", "F5_missing_counterpart", "F6_extra_counterpart", "F7_method_path_mismatch", "F8_openapi_stale", "F9_runtime_unavailable", "F10_static_runtime_mismatch", "F11_intent_missing_or_stale", "F12_uncovered_journey", "F13_unknown_effect", "F14_absent_schedule", "F15_secret_or_pii_input", "F16_h3_authority_copy", "F17_locale_order", "F18_stale_artifact_diff", "F19_ignore_residual_precedence"]},
    "projection_write": {"$ref": "#/$defs/projectionWrite"},
    "source_manifest_sha256": {"type": ["string", "null"], "pattern": "^sha256:[0-9a-f]{64}$"},
    "inventory_artifact_sha256": {"type": "object", "patternProperties": {"^[A-Za-z0-9._-]+$": {"type": "string", "pattern": "^sha256:[0-9a-f]{64}$"}}, "additionalProperties": false},
    "row_counts": {"type": "object", "patternProperties": {"^[A-Za-z0-9._-]+$": {"type": "integer", "minimum": 0}}, "additionalProperties": false},
    "status_counts": {"type": "object", "patternProperties": {"^[A-Za-z0-9._-]+$": {"type": "integer", "minimum": 0}}, "additionalProperties": false},
    "failures": {"type": "array", "items": {"$ref": "#/$defs/failure"}},
    "mismatches": {"type": "array", "items": {"$ref": "#/$defs/mismatch"}},
    "openapi_reconciliation_ref": {"type": "string", "const": "openapi-reconciliation.json"},
    "verification": {"$ref": "#/$defs/verification"}
  },
  "allOf": [
    {"if": {"properties": {"status": {"const": "zero_gap"}}}, "then": {"properties": {"exit_code": {"const": 0}, "mode": {"const": "diff"}, "falsifier_id": {"type": "null"}, "projection_write": {"properties": {"status": {"const": "not_requested"}}}, "source_manifest_sha256": {"$ref": "#/$defs/sha256"}, "inventory_artifact_sha256": {"minProperties": 1}, "failures": {"maxItems": 0}, "mismatches": {"items": {"properties": {"disposition": {"not": {"enum": ["none", "rejected"]}}}}}, "openapi_reconciliation_ref": {"const": "openapi-reconciliation.json"}, "verification": {"properties": {"schema_validation": {"const": true}, "cross_reference_validation": {"const": true}, "deterministic_diff": {"const": "equal"}, "forbidden_states_empty": {"const": true}}}}}},
    {"if": {"properties": {"status": {"const": "projection_written"}}}, "then": {"properties": {"exit_code": {"const": 14}, "mode": {"const": "write"}, "falsifier_id": {"type": "null"}, "projection_write": {"properties": {"status": {"const": "written"}}}, "failures": {"maxItems": 0}, "verification": {"properties": {"schema_validation": {"const": true}, "cross_reference_validation": {"const": true}, "deterministic_diff": {"const": "not_run"}, "forbidden_states_empty": {"const": true}}}}}},
    {"if": {"properties": {"mode": {"const": "write"}}}, "then": {"properties": {"falsifier_id": {"type": "null"}, "verification": {"properties": {"deterministic_diff": {"const": "not_run"}}}}}},
    {"if": {"properties": {"mode": {"const": "diff"}}}, "then": {"properties": {"falsifier_id": {"type": "null"}, "verification": {"properties": {"deterministic_diff": {"enum": ["equal", "different"]}}}}}},
    {"if": {"properties": {"mode": {"const": "fixture_injection"}}}, "then": {"required": ["falsifier_id"], "properties": {"falsifier_id": {"type": "string", "enum": ["F0_deterministic_replay", "F1_missing_required_source", "F2_source_hash_drift", "F3_duplicate_legacy_route", "F4_dead_unimported_source", "F5_missing_counterpart", "F6_extra_counterpart", "F7_method_path_mismatch", "F8_openapi_stale", "F9_runtime_unavailable", "F10_static_runtime_mismatch", "F11_intent_missing_or_stale", "F12_uncovered_journey", "F13_unknown_effect", "F14_absent_schedule", "F15_secret_or_pii_input", "F16_h3_authority_copy", "F17_locale_order", "F18_stale_artifact_diff", "F19_ignore_residual_precedence"]}, "status": {"not": {"const": "zero_gap"}}, "projection_write": {"properties": {"status": {"const": "blocked"}}}}}},
    {"if": {"properties": {"status": {"const": "falsifier_passed"}}}, "then": {"properties": {"exit_code": {"const": 13}, "mode": {"const": "fixture_injection"}}}}
  ],
  "$defs": {
    "sha256": {"type": "string", "pattern": "^sha256:[0-9a-f]{64}$"},
    "projectionWrite": {"type": "object", "additionalProperties": false, "required": ["status", "target_ref"], "properties": {"status": {"type": "string", "enum": ["not_requested", "written", "blocked"]}, "target_ref": {"type": ["string", "null"], "minLength": 1}}},
    "failure": {"type": "object", "additionalProperties": false, "required": ["failure_id", "status", "reason_code", "row_ids", "source_ref_ids"], "properties": {"failure_id": {"type": "string", "pattern": "^failure-[a-f0-9]{64}$"}, "status": {"type": "string", "enum": ["gaps_found", "unresolved", "duplicate", "stale", "source_unavailable", "source_hash_drift", "schema_invalid", "nondeterministic_output", "runtime_unavailable", "accepted_intent_invalid", "command_error"]}, "reason_code": {"type": "string", "pattern": "^[A-Z][A-Z0-9_]{2,63}$"}, "row_ids": {"type": "array", "uniqueItems": true, "items": {"type": "string", "pattern": "^row-[a-f0-9]{64}$"}}, "source_ref_ids": {"type": "array", "uniqueItems": true, "items": {"type": "string", "minLength": 1}}, "accepted_intent_ref_ids": {"type": "array", "uniqueItems": true, "items": {"type": "string", "minLength": 1}}}},
    "mismatch": {"type": "object", "additionalProperties": false, "required": ["kind", "row_ids", "disposition", "accepted_intent_ref_ids"], "properties": {"kind": {"type": "string", "enum": ["missing", "extra", "changed", "renamed", "split", "merged", "dead_unimported", "absent", "uncovered", "unresolved", "duplicate", "stale", "openapi_stale"]}, "row_ids": {"type": "array", "minItems": 1, "uniqueItems": true, "items": {"type": "string", "pattern": "^row-[a-f0-9]{64}$"}}, "disposition": {"type": "string", "enum": ["none", "accepted_missing", "accepted_extra", "accepted_changed", "accepted_renamed", "accepted_split", "accepted_merged", "accepted_dead_source", "accepted_absent", "accepted_not_applicable", "rejected"]}, "accepted_intent_ref_ids": {"type": "array", "uniqueItems": true, "items": {"type": "string", "minLength": 1}}}, "allOf": [{"if": {"properties": {"disposition": {"enum": ["accepted_missing", "accepted_extra", "accepted_changed", "accepted_renamed", "accepted_split", "accepted_merged", "accepted_dead_source", "accepted_absent", "accepted_not_applicable"]}}}, "then": {"properties": {"accepted_intent_ref_ids": {"minItems": 1}}}}, {"if": {"properties": {"disposition": {"enum": ["none", "rejected"]}}}, "then": {"properties": {"accepted_intent_ref_ids": {"maxItems": 0}}}}, {"if": {"properties": {"disposition": {"const": "accepted_absent"}}}, "then": {"properties": {"kind": {"const": "absent"}}}}]},
    "verification": {"type": "object", "additionalProperties": false, "required": ["canonical_json", "schema_validation", "cross_reference_validation", "deterministic_diff", "forbidden_states_empty"], "properties": {"canonical_json": {"type": "string", "const": "recursive-key-sort/byte-order-array-sort/compact-utf8/no-newline"}, "schema_validation": {"type": "boolean"}, "cross_reference_validation": {"type": "boolean"}, "deterministic_diff": {"type": "string", "enum": ["equal", "different", "not_run"]}, "forbidden_states_empty": {"type": "boolean"}}}
  }
}
