{"$schema":"https://json-schema.org/draft/2020-12/schema","exit_code":6,"failures":[{"accepted_intent_ref_ids":[],"failure_id":"failure-ed2508f3ea11332bb242adc18d8acd62a44af960452d8dbf47fcfd0ca8ea3e0e","reason_code":"UNSAFE_SOURCE","row_ids":[],"source_ref_ids":[],"status":"source_unavailable"}],"falsifier_id":null,"inventory_artifact_sha256":{},"mismatches":[],"mode":"diff","openapi_reconciliation_ref":"openapi-reconciliation.json","projection_write":{"status":"blocked","target_ref":null},"row_counts":{},"schema_version":"functional-parity-zero-gap-report/v1","source_manifest_sha256":null,"status":"source_unavailable","status_counts":{},"verification":{"canonical_json":"recursive-key-sort/byte-order-array-sort/compact-utf8/no-newline","cross_reference_validation":false,"deterministic_diff":"different","forbidden_states_empty":false,"schema_validation":false}}
